ProductID,ProductName,ProductGroupID,Price,StockQuantity,Description,Manufacturer,WarrantyPeriod,ReleaseDate,SKU,Weight,Dimensions
168,Admit,10,94.46,927,Ever skill phone program someone this traditional return build add form.,Burns-Miller,3 years,2021-09-13,dv-23516277,106.69,23x25x44 cm
169,Her,5,42.71,867,After car throughout effort could war two.,Griffin and Sons,2 years,2020-07-07,wB-71088877,470.83,30x45x32 cm
170,Public,13,22.5,491,Would as magazine public claim walk continue large sign also Republican top memory.,Brown LLC,4 years,2022-10-20,bZ-11684265,412.55,3x45x35 cm
171,Go,18,0.01,354,Standard property teacher exist air reflect read.,Newman Inc,5 years,2019-12-28,Hb-44632043,388.5,1x30x33 cm
172,Happy,19,16.22,461,Quite fish less each either team.,Braun Inc,1 years,2020-09-11,JI-08079019,101.08,28x33x49 cm
173,Herself,6,17.6,814,Fund cause would red as economic practice on make start increase car sister.,Orr-Hernandez,3 years,2021-09-25,QB-20466389,84.15,1x3x24 cm
174,Perhaps,19,43.53,241,Whole position fill role meet cup quality agency same pretty.,"Zamora, Reed and King",2 years,2021-03-23,Hy-00486235,519.0,29x41x14 cm
175,Media,11,25.38,443,From meeting those beat culture move population thousand cover one.,"Powell, Ortega and Pope",4 years,2020-01-08,qd-23774254,88.94,14x14x8 cm
176,Agent,9,12.54,313,Possible green skin turn better yeah.,Martin-Davis,5 years,2023-04-12,VD-43443137,413.91,14x23x2 cm
177,Provide,8,8.37,874,Now real none only foreign law always seek recently.,Ramirez PLC,2 years,2021-12-26,nS-46624327,36.12,8x39x6 cm
178,Certain,16,4.11,675,Development share day really culture bar also eat any inside.,"Jones, Griffith and Russell",2 years,2019-10-27,JV-89992467,99.89,6x6x16 cm
179,Sure,4,6.57,342,Road eight interesting if success fine huge.,Silva-Jacobs,2 years,2022-04-08,kI-48332945,130.14,29x24x35 cm
180,View,4,0.42,819,Health investment question reveal traditional right probably investment.,Padilla-Davis,1 years,2024-04-21,uy-23159325,138.41,23x40x1 cm
181,Property,18,26.12,112,Job husband concern involve possible put interview within stand town.,Glenn Ltd,4 years,2021-05-13,lJ-37878286,192.43,5x3x19 cm
182,Especially,20,4.05,388,Fly go get board two wind.,"Webster, Olson and Ray",2 years,2021-04-15,No-67045955,571.42,30x49x21 cm
183,Education,13,5.24,526,Structure far think work note identify field network table court.,Lowery-Martin,2 years,2020-07-14,gg-17830834,266.0,42x33x30 cm
184,Pass,1,17.64,404,Peace guy ask across indicate husband.,Becker Inc,1 years,2020-04-18,BT-02315600,359.49,10x39x9 cm
185,Lose,17,24.54,762,Draw computer ground on listen improve animal.,Anderson-Gomez,3 years,2021-09-03,AI-28963464,395.13,29x32x39 cm
186,Perhaps,1,17.81,808,Power impact sound size popular part whose sea enjoy despite.,Oneal Group,1 years,2022-03-31,qt-74578769,37.9,38x47x27 cm
187,Generation,19,15.74,599,Structure experience court foot possible wonder candidate do moment opportunity room.,Williams Ltd,1 years,2024-05-30,sy-72509206,249.66,18x20x47 cm
188,Garden,1,51.86,942,Attorney company realize mother peace soon international threat.,"Allen, Sanchez and Hoffman",1 years,2021-08-11,dW-15874599,112.11,30x48x32 cm
189,View,19,42.46,571,Benefit north clearly especially follow edge across bag visit bad involve best.,Fernandez LLC,1 years,2020-04-03,nh-02052085,317.66,42x25x17 cm
190,Trouble,20,39.39,403,Make range necessary role effect stop day woman political prevent nor remain minute.,"Berg, Beltran and Stevens",5 years,2021-07-12,Zk-24180007,575.01,12x31x6 cm
191,Step,18,31.59,77,Interesting why me too computer movement off become remain future.,Zavala-Villa,5 years,2023-07-28,No-07253859,79.41,5x38x17 cm
192,Democrat,6,74.97,905,Along box herself tax can nothing two according here peace institution me follow.,Nelson-Foster,4 years,2022-04-12,yr-83259524,30.09,28x10x17 cm
193,Nice,5,30.72,467,Office majority long fine sure western.,"Nichols, Rogers and Lynch",4 years,2024-04-28,MX-68387548,216.51,47x19x6 cm
194,Budget,17,34.02,853,Born year small eat threat per moment nearly money table include point old.,Jones-Perez,3 years,2022-03-25,Go-19925651,834.31,43x35x10 cm
195,Blue,4,50.02,237,Anyone image technology article memory five animal head seem crime never carry.,Roberson Inc,3 years,2021-04-11,on-58136817,86.9,11x9x25 cm
196,Ask,13,36.24,940,Send such kitchen your be travel wall part others evidence fact account enough.,"Robinson, Guerrero and Weaver",1 years,2020-04-20,TK-39578054,308.58,5x48x47 cm
197,Decade,17,37.31,911,Decade glass upon success recognize create such lot reflect dark.,"Brooks, Padilla and Crawford",2 years,2023-01-22,qF-39512000,47.03,15x19x36 cm
198,Much,17,15.8,87,Glass message west glass its opportunity at mother visit weight open year.,"Jones, Vasquez and Rowe",5 years,2022-02-11,Yb-21180806,44.94,32x18x23 cm
199,Four,2,3.81,419,Fine bill generation practice between law although administration provide.,"Willis, Adams and Adams",3 years,2021-11-01,sm-08886442,605.82,14x18x48 cm
200,International,2,73.46,944,Employee training break space moment although child officer surface discussion understand.,"Mitchell, Welch and Frazier",5 years,2021-04-25,JB-38140445,100.41,30x14x14 cm
