ProductID,ProductName,ProductGroupID,Price,StockQuantity,Description,Manufacturer,WarrantyPeriod,ReleaseDate,SKU,Weight,Dimensions
1,Opportunity,5,3.7,177,Popular everybody middle say key law create.,Humphrey-Wright,1 years,2019-09-28,Mz-69542729,370.28,47x37x37 cm
2,Through,8,1.68,363,Material serve heavy establish black either.,Henderson-Walsh,4 years,2020-10-03,QD-15913559,734.47,47x36x11 cm
3,Believe,7,1.29,139,Member interest some wind rule brother response meet better develop why section.,Warner Inc,3 years,2023-11-05,Kn-23429154,467.93,34x30x27 cm
4,Pass,14,51.72,776,Line pass guy capital discover Mr local west.,Rodgers-Stevens,1 years,2020-02-24,Hr-45274455,167.36,28x6x22 cm
5,Board,18,10.6,449,Family way minute firm able heavy.,Reynolds Group,3 years,2023-05-26,er-63806505,389.94,11x14x38 cm
6,Total,20,15.1,756,Section sure conference point same among billion region number.,Taylor Inc,3 years,2022-10-15,gu-47237193,357.32,46x28x17 cm
7,Seek,19,12.79,50,Operation ability help our yard although under up religious building.,Klein Ltd,3 years,2022-03-08,KY-16689567,41.35,26x50x7 cm
8,Control,20,11.97,142,Mind one fine safe or throw skin.,Haley and Sons,1 years,2023-05-11,qb-49248268,262.43,13x4x22 cm
9,Yet,4,28.21,261,This them true exist Mr arrive happen campaign indeed participant how watch.,Page-Rogers,2 years,2024-01-09,ep-98469779,28.44,40x47x40 cm
10,Fire,7,1.09,434,Window experience manage ground hospital discuss may health win stage answer.,"Garcia, Calhoun and Brandt",2 years,2022-07-07,xz-95413823,411.84,34x12x41 cm
11,Available,4,21.46,577,Month gun economy customer once across man benefit budget keep.,"Cordova, Marshall and Terry",1 years,2023-02-13,RC-72563076,16.45,31x1x46 cm
12,Parent,13,20.96,597,Character four long understand list win onto create strategy enjoy.,"Beltran, Harper and Kelly",2 years,2021-11-20,lr-53368899,205.7,29x46x3 cm
13,Medical,12,52.9,920,Relate present reflect lawyer star finally late feeling.,Molina-Morgan,5 years,2024-05-18,vC-86310941,99.88,20x6x30 cm
14,Performance,2,10.56,700,During special bar will summer easy send establish.,Gonzalez-Baker,3 years,2021-03-31,Sp-19914508,758.24,27x18x17 cm
15,Usually,7,36.1,994,Also experience himself eat read participant action.,"Simpson, Franco and Lucas",3 years,2021-02-17,UL-17683062,229.82,7x34x22 cm
16,Most,17,90.38,251,Decade box green hope suffer past its available window sometimes executive even view.,Thomas LLC,2 years,2020-02-06,kT-95273216,417.02,43x19x14 cm
17,Official,9,70.43,949,Game trial minute soon station reality.,Cooper-Moses,3 years,2021-05-05,wr-09688889,615.81,26x15x27 cm
18,Five,9,0.4,407,Process song buy environmental off order around painting admit necessary cold but.,"Wilson, Callahan and White",1 years,2023-07-17,zH-85174750,128.42,2x17x17 cm
19,Society,20,61.56,735,Fly activity board marriage alone hit ten late cell early girl.,Turner Inc,1 years,2021-08-25,xS-80875449,681.56,46x2x16 cm
20,Table,16,3.85,545,Commercial beautiful knowledge tough someone could research.,Weaver LLC,4 years,2021-05-08,mB-44961283,148.15,11x10x31 cm
21,Center,9,12.25,134,Chair real do tough town see spend.,Daugherty-Mathews,4 years,2020-02-15,DH-36550985,151.35,17x32x26 cm
22,Party,12,20.17,20,Care buy senior which would toward.,Schneider Group,5 years,2020-10-18,oK-63246216,413.88,26x20x43 cm
23,Century,14,54.73,271,Type information break she be house news me.,"Armstrong, Summers and Gilbert",2 years,2023-02-05,kZ-75860846,228.9,25x28x32 cm
24,Process,9,12.88,147,Painting on last speak general these year but direction movie certain.,Rogers-Goodman,4 years,2023-06-10,JJ-94047289,222.82,3x17x11 cm
25,Fund,18,5.79,352,Attorney might cultural we hit box agreement natural enjoy.,Bryant LLC,3 years,2021-10-28,yp-21601676,75.43,17x25x11 cm
26,Better,16,8.53,429,Oil Democrat address despite agency they into serious truth price learn base anyone.,"Williams, Davila and Campbell",3 years,2024-02-16,XS-58846403,80.67,47x33x26 cm
27,Any,18,0.03,601,Now ability fact successful only they present nearly create activity.,Griffin Group,2 years,2020-05-24,uy-02998190,463.62,9x50x10 cm
28,Join,3,34.02,931,Administration daughter chair response clear character.,"Williams, Chapman and Hansen",1 years,2020-02-04,Nt-68565280,372.27,26x28x46 cm
29,Use,16,67.35,643,Country effort kid industry us care four bill success.,"Thornton, Brennan and Walker",1 years,2020-01-21,ui-11268517,93.62,19x4x27 cm
30,Couple,3,68.9,286,Direction contain after usually character gas television who window when speech strategy.,Henderson-Rodriguez,5 years,2023-03-11,Ha-92485685,322.55,46x9x1 cm
31,Answer,1,2.52,660,Car style measure performance summer drop realize everyone agreement.,White and Sons,4 years,2022-10-01,UZ-73805337,216.33,49x50x34 cm
32,Try,9,9.82,178,Nothing better never certain manage people we.,Watson-Cobb,2 years,2021-01-12,WU-68905430,190.67,26x41x49 cm
33,Around,12,14.4,781,Fall strategy spring man now sing contain when key benefit upon certain attention race.,Lloyd-Reed,2 years,2020-02-09,pv-45687016,403.09,43x16x41 cm
34,Senior,18,41.0,966,Model agency color not pretty nothing yard significant which part general rate.,Williams-Reid,3 years,2023-05-03,RJ-68501981,267.02,37x16x34 cm
35,Official,4,17.56,328,Behavior unit support mission certain where executive foot Congress production.,Williams-Patterson,5 years,2024-02-15,Ih-93328333,286.5,4x26x46 cm
36,Perform,20,32.06,423,Wear citizen speak miss enter across government knowledge eat explain build system media.,Smith-Miller,2 years,2020-08-25,wN-91563008,16.32,5x5x47 cm
37,Stay,8,0.97,910,Per region change recent involve magazine because include social edge.,"Gilbert, Martin and Warren",1 years,2021-07-30,LU-35890800,422.19,19x4x11 cm
38,Require,6,61.42,852,Or at sing specific down skin bar.,Jones and Sons,1 years,2020-02-25,Eb-84670516,597.13,2x46x43 cm
39,Leader,16,36.07,359,Fine general join suddenly recently own truth action agent crime exist.,"Hickman, Mccoy and Riggs",4 years,2020-09-04,CB-91339967,198.81,21x42x21 cm
40,Catch,6,14.35,201,Management would throughout space tonight edge arm last one enough phone including single.,Bentley Ltd,5 years,2022-05-26,eu-93482374,467.89,16x10x22 cm
41,Against,1,4.04,770,Contain member center reduce second magazine.,Leonard-Castaneda,2 years,2021-11-18,sO-38526186,845.87,38x30x41 cm
42,On,10,23.93,857,Actually who his record wide board chair sister old safe season theory.,"Todd, Williams and Porter",2 years,2023-07-30,EZ-02385621,278.22,17x37x43 cm
43,Commercial,18,12.23,930,Free camera tonight thank child might agreement.,Campbell-Moon,3 years,2023-07-07,jn-68873859,212.16,17x28x15 cm
44,Thus,20,16.16,902,Suggest list six red will news action.,Sandoval and Sons,1 years,2019-11-28,Kk-13997696,335.22,1x14x44 cm
45,Safe,11,15.58,685,Campaign usually report factor represent fish style candidate result investment machine.,Zavala-Whitaker,2 years,2024-02-07,Vd-36048321,14.84,28x19x48 cm
46,Sure,9,26.18,852,Throw final local ahead marriage sometimes thousand left difficult source.,Burch PLC,3 years,2022-09-21,RP-47706505,65.47,46x28x17 cm
47,With,4,6.89,666,Tell free grow nothing hour bank only conference subject.,Guerrero and Sons,1 years,2020-12-11,aC-88673797,76.19,8x13x5 cm
48,Well,15,8.65,59,Side seek team behavior security trade go allow a need now cold.,"Raymond, Gordon and Martinez",2 years,2024-01-22,Eu-07225383,32.23,12x39x40 cm
49,Realize,7,35.39,136,Affect cup describe physical give measure group born western cell treatment think parent.,"Simmons, Ramirez and Wilson",4 years,2020-03-02,vo-18410751,266.43,46x10x42 cm
50,A,9,77.56,438,Two then analysis black they perhaps national baby reality challenge.,Johnson-Green,2 years,2019-10-16,AQ-75128241,171.65,31x33x11 cm
51,Sense,13,54.28,336,Past condition serve huge space reality wish actually turn might together take short then.,"Howell, Brown and King",5 years,2021-11-14,VJ-72755807,54.18,45x21x19 cm
52,Out,12,15.51,867,Bit because both trouble with assume feeling why.,Johnson Ltd,1 years,2022-07-25,wG-05392244,413.96,10x14x14 cm
53,Court,20,18.22,567,Protect stay event front behind half.,Osborne and Sons,5 years,2023-01-01,XH-84591558,649.69,31x21x41 cm
54,Possible,15,3.28,700,Beautiful news nation guy have consumer beat economic lot give inside.,"Cook, Lopez and Wood",2 years,2024-02-29,fA-79217705,496.6,48x12x2 cm
55,Enough,14,8.16,840,Assume culture their live sure part hundred scene edge really red executive free.,"Ferrell, Gibson and Terry",2 years,2019-09-09,Bo-34202310,46.49,33x32x6 cm
56,Network,3,15.17,791,System full tonight next home turn ago mother.,Beard-Brown,2 years,2022-06-06,SW-80620893,63.24,50x24x31 cm
57,Police,20,12.4,737,Share fall note gas back push key single only wait.,Flores-Gomez,4 years,2021-04-21,Qx-00184299,449.02,27x38x16 cm
58,Authority,8,4.02,481,Against understand color free future and cell main director you have.,Arnold-Reyes,4 years,2023-01-29,uM-27479849,292.54,13x15x7 cm
59,Imagine,4,9.9,180,Weight single his court serious response line.,Nguyen and Sons,1 years,2021-02-14,Xd-21715250,330.08,21x35x40 cm
60,Into,9,54.96,121,Wonder cause pattern TV west single half middle claim push measure machine decide.,"Oliver, Wagner and Harris",2 years,2023-12-11,zQ-81826545,130.61,23x6x27 cm
61,Involve,16,26.02,901,Finish draw night show hear exist fire cultural.,Stewart-Torres,1 years,2020-02-26,aF-44212093,233.59,37x33x21 cm
62,Expert,10,62.17,963,Talk heart senior sure job seem fill practice right others.,Holmes-King,3 years,2021-04-21,DA-14765059,165.22,43x3x39 cm
63,Never,6,21.94,17,Onto article yet agency some threat room environmental prevent player.,"Kirk, Wu and Porter",3 years,2021-02-16,fv-02888079,704.1,32x46x32 cm
64,Personal,13,11.88,687,Movie water record business help best Mr professional.,Schaefer Ltd,5 years,2021-04-17,kb-28397529,133.46,43x10x42 cm
65,Land,17,29.13,857,Hope avoid often investment brother majority decide part something analysis bill ever energy.,"Jones, Bates and Jones",1 years,2021-03-07,zk-40511974,259.16,4x37x49 cm
66,Take,19,12.33,492,See account impact occur back plant by it.,"Davidson, Gonzalez and Gibbs",1 years,2020-09-23,Dc-39088093,16.22,29x12x8 cm
67,Down,14,6.8,339,Hear hear back baby others manage fire field.,"Thomas, Vazquez and Patterson",5 years,2023-10-03,qA-68401199,143.07,38x21x20 cm
68,He,1,8.32,313,Everything first father nothing stuff let onto lose mean loss analysis home.,"Dean, Koch and Reed",4 years,2019-09-03,Jh-56441067,170.58,31x22x38 cm
69,Class,11,7.69,696,Buy include reach activity citizen game ok include ok author future candidate already.,"Hodges, Smith and Morrison",5 years,2021-01-24,nG-96441595,240.7,41x24x35 cm
70,Force,6,58.51,379,Reach own when beat accept manager method ground Republican we part.,Flowers PLC,3 years,2022-12-18,WG-13866120,162.5,29x18x11 cm
71,Never,12,4.01,980,Possible federal statement natural very special.,"Jackson, Gill and Turner",5 years,2020-07-18,bc-62665639,36.56,33x35x28 cm
72,Cup,16,49.76,657,Program we admit throw quite economic religious theory.,"Casey, Miranda and Moreno",5 years,2020-02-17,tU-08414640,219.75,39x48x5 cm
73,Audience,14,79.13,802,Part community suffer production left view these let feeling.,"Banks, George and James",1 years,2020-11-10,cP-35656271,123.03,8x29x45 cm
74,Contain,1,10.9,181,Green example kind suffer professional interesting firm Congress Republican end star long clearly.,Porter LLC,1 years,2020-12-30,iP-19398102,297.36,25x6x4 cm
75,Mean,12,3.36,45,Customer song strong whether three because bill space dream help full necessary.,Gonzalez-Thompson,4 years,2020-09-21,Hp-81381716,102.73,15x50x2 cm
76,Eye,17,61.1,873,Factor science daughter explain wall indeed building lose.,Dean-Watson,2 years,2022-01-26,CQ-11599434,45.66,9x43x28 cm
77,Catch,11,18.08,695,Pick senior suffer property environmental let management bad peace argue seven democratic themselves.,Daniels-Vargas,4 years,2020-05-02,dg-05349635,639.66,25x29x27 cm
78,Customer,14,69.81,545,Operation late skin real kind low speech wonder.,"Jones, Pearson and Barnes",2 years,2020-03-17,Pi-83803207,205.0,36x6x10 cm
79,Red,11,10.5,277,Safe weight figure such office help can woman will project.,Smith-Miller,3 years,2021-02-15,SB-18991079,265.01,36x20x38 cm
80,Impact,1,58.8,97,Player others option security contain physical law produce stay mind number.,Williams Group,1 years,2023-02-24,Gl-67433183,9.08,37x10x18 cm
81,Democratic,18,25.07,521,Daughter seven nice speak too fine free you.,"Hoover, Collins and Young",3 years,2022-08-12,em-78341296,497.24,42x31x34 cm
82,Most,11,29.02,685,Consumer recognize card movement analysis organization part those tree.,Richards LLC,5 years,2020-04-24,gl-45842354,55.7,42x24x38 cm
83,Guy,5,22.32,387,Strong program leg institution cell back.,"Beck, Thompson and Taylor",4 years,2021-10-11,aF-57138892,157.3,24x32x45 cm
84,Cost,3,84.77,894,Health class artist beautiful ever same somebody vote need ten.,Hill Group,5 years,2024-01-31,rK-42834402,39.67,35x42x33 cm
85,Others,18,78.1,416,Buy determine group development fire own expect business mother hospital his very challenge.,"Gilmore, Smith and King",2 years,2020-09-09,zj-85212098,46.89,37x9x29 cm
86,Go,1,18.75,622,Job have age here common painting involve participant dog accept president.,Chen-Johnson,4 years,2020-04-13,ch-08802189,81.14,26x5x19 cm
87,Movement,1,25.64,29,Particular car example interview size effect window suddenly range conference nor official.,Adams-Espinoza,1 years,2022-03-27,Pn-68036247,163.43,31x15x10 cm
88,Your,18,5.53,617,Above marriage accept mission determine star.,Fisher-Taylor,4 years,2024-04-20,sq-69462934,149.26,42x41x16 cm
89,Think,17,35.42,168,Organization always any land its subject outside push member stuff story.,Jenkins Ltd,1 years,2021-07-02,Jo-82963373,403.46,36x4x34 cm
90,Office,7,29.7,646,Front able support approach employee front really seven guess not physical recognize court.,Morgan-Carlson,3 years,2021-10-25,NG-75264215,565.94,20x48x41 cm
91,Support,13,41.66,615,Physical and beyond story simple here none daughter meet TV.,Barron and Sons,2 years,2020-07-30,RQ-26182099,121.59,40x45x39 cm
92,With,14,21.96,654,Again special yourself store small generation must majority opportunity.,Green-Porter,5 years,2022-02-03,aH-48780645,190.3,5x29x23 cm
93,Compare,7,32.36,143,Factor hair girl still fire soon respond opportunity situation.,"Jones, Walker and Keith",1 years,2024-01-01,aP-41265081,223.13,46x29x2 cm
94,Design,6,57.69,940,Chair quickly gas manager six town give involve specific.,"Morales, Downs and Holland",1 years,2021-05-17,ea-38084452,226.64,43x30x26 cm
95,Which,19,78.19,626,Name technology next exactly deal claim customer will out its card between.,"Smith, Blackwell and Smith",4 years,2023-07-02,rg-33280503,598.17,36x18x4 cm
96,Character,15,6.75,334,All miss phone huge southern machine pretty health throughout expect.,Dougherty-Spencer,1 years,2024-06-01,Eu-79612197,274.19,23x40x12 cm
97,Certainly,16,36.34,724,End bring minute plant write it.,Brewer Inc,1 years,2021-09-06,Bj-97171804,162.48,50x1x33 cm
98,They,8,13.15,776,Left site evidence eight environment simple.,"Roberts, Mejia and Villa",1 years,2023-08-17,Nm-30795216,292.34,46x20x5 cm
99,Should,10,22.72,639,Consumer good TV suddenly board college quite action.,"Reed, White and Humphrey",4 years,2020-06-18,hV-89013012,171.27,34x32x32 cm
100,Course,9,3.95,268,Tend management natural all relationship method happen local hold painting occur.,Leblanc Group,4 years,2022-01-04,JQ-82809492,86.34,44x35x24 cm
101,Goal,3,30.56,841,You bring central let audience evidence property general action stage even fast four.,Blake-Dennis,5 years,2024-03-03,VF-21340111,278.53,38x28x41 cm
102,Lot,20,5.11,510,Really age space because environmental beyond idea.,Bailey PLC,1 years,2019-10-05,Aw-60027405,41.25,11x9x34 cm
103,Police,20,44.99,26,Hear style election series per popular our put including success research.,"Solis, Jones and Woodward",3 years,2024-01-13,VK-30158868,25.97,6x33x11 cm
104,Material,18,8.84,489,Country pay point deep decide anyone north audience.,Barry and Sons,1 years,2022-08-22,pA-03693153,374.27,24x41x37 cm
105,Plan,8,27.33,189,Notice would point never second dark call entire animal lay.,Barnett PLC,4 years,2020-11-03,Mg-76656156,448.92,31x8x22 cm
106,Necessary,2,37.48,753,Child hear natural line range concern get draw here.,"Watts, Torres and Alexander",2 years,2023-07-01,si-83888290,508.8,34x29x33 cm
107,Still,5,33.91,669,Interview rich line opportunity table PM adult water old.,Hughes-Lewis,2 years,2022-04-16,RQ-44490547,443.78,8x8x1 cm
108,Bar,17,24.08,214,Cold gun moment bag case small star.,"Nguyen, Crawford and Sanchez",4 years,2022-07-02,Lu-43131160,64.63,42x11x43 cm
109,Difficult,1,13.58,235,Particular or prepare tree win form stop fast human discuss stock nearly.,Garza-Garcia,3 years,2019-07-31,LN-37488232,869.25,13x13x30 cm
110,He,2,16.12,756,Concern song everyone person opportunity analysis near him reason teach.,"Carpenter, Harrison and Garcia",3 years,2023-05-08,Ae-37074947,70.37,4x2x4 cm
111,Condition,17,16.0,209,Test they beyond natural mention significant move stay animal open goal out debate.,Kelley Group,1 years,2024-04-18,vA-44177936,98.65,38x21x8 cm
112,Use,1,34.64,793,Side apply as anyone physical best bag capital process establish hour whose.,Turner LLC,1 years,2021-04-22,KS-37663780,249.93,18x41x46 cm
113,Rest,5,38.03,235,Sport explain consider market defense imagine moment.,Carroll-Wilson,4 years,2022-05-17,pf-40295388,613.83,1x19x35 cm
114,Sport,19,8.58,19,Decade call huge my start sea war top.,Pierce-Kidd,3 years,2022-06-01,Re-74176103,469.57,4x24x39 cm
115,Rate,6,18.87,161,Large imagine fast six type try free international may score senior tough itself.,Matthews LLC,4 years,2022-03-30,Mn-06796341,267.31,29x28x6 cm
116,Pressure,8,27.98,276,Serious environmental success guess speech small business.,Gibson Group,3 years,2022-02-11,gQ-68798072,234.94,21x14x23 cm
117,Alone,6,27.21,970,Whose him put create appear turn including.,"Chambers, Nelson and Poole",4 years,2022-07-05,oO-96769206,575.07,32x5x31 cm
118,Out,13,20.39,991,Bit loss car minute forward improve space bag simple popular listen middle bed.,Pittman-Morris,4 years,2023-11-17,Ar-32375808,207.55,33x17x37 cm
119,Region,15,5.77,965,Clear company above shoulder on determine.,Thomas Inc,3 years,2022-08-21,Wi-97020539,128.4,42x46x21 cm
120,Loss,15,45.62,147,Up party rest foreign adult town fast reflect perform including turn involve stock.,"Dillon, Stark and Mcdaniel",4 years,2021-08-22,Ec-79343711,556.28,47x1x40 cm
121,Human,15,2.22,414,Of lose fund painting have north mission compare.,"Vazquez, Warren and Williams",1 years,2021-05-05,Sr-73515392,90.33,27x33x35 cm
122,Raise,11,54.7,100,International something cell information visit special.,Martinez Group,1 years,2022-06-14,Bu-98130879,81.84,32x47x48 cm
123,Picture,10,5.04,867,Country time great control hour lead.,"Cameron, Middleton and Morgan",4 years,2020-09-17,zT-74973000,168.01,25x24x6 cm
124,Upon,10,26.11,426,Toward opportunity keep apply station training during live spring question character sing economy.,Gonzalez-Moore,5 years,2019-11-18,zl-07832187,621.72,24x2x20 cm
125,Improve,18,74.14,392,History hospital brother my alone across detail air build.,Young-Jackson,5 years,2021-02-25,pQ-89665060,447.54,39x2x33 cm
126,Have,14,23.37,45,Democrat without measure adult social voice ok.,Jimenez-Burgess,1 years,2023-11-12,MP-19601066,379.8,44x33x1 cm
127,Particularly,8,39.07,854,Word three capital sell day during up pretty toward.,Burnett and Sons,2 years,2023-02-13,hk-24367096,125.08,23x23x28 cm
128,Others,20,4.07,295,Notice early my maintain plan play choose kind little beyond.,"Burke, Bennett and Burns",5 years,2023-02-14,Ui-24342494,221.11,5x5x6 cm
129,Summer,14,57.08,220,Pm green public natural thus subject travel identify skin side difficult.,Jones-Vasquez,1 years,2019-08-27,uR-93339687,20.55,48x1x22 cm
130,End,16,66.92,387,Mission person prove rule either former address guy game now.,"Hickman, Schroeder and Williams",5 years,2022-08-18,IG-89273125,23.54,45x26x5 cm
131,Best,1,47.14,885,Chair after right receive read modern young accept early father at nation.,"Nicholson, Ross and Ferguson",2 years,2022-12-09,BB-29829048,190.08,3x15x9 cm
132,Once,19,7.26,25,Some perform possible produce often actually none relate sound now.,"Olsen, Reyes and Fisher",2 years,2023-07-29,MC-80656085,397.7,41x23x33 cm
133,Responsibility,9,44.39,800,Country ahead nature information doctor break film even stop attorney decade recent six.,Gates-Hall,4 years,2022-01-05,lk-92551352,94.33,31x24x20 cm
134,Population,8,0.77,279,Along man mind eight stuff easy evening teacher use father himself partner.,"Davis, Cole and Wagner",4 years,2021-01-26,TS-34601210,21.47,26x28x40 cm
135,Training,15,32.35,85,Matter energy hour above worry any I writer boy because international bit black.,Cortez-Lucas,5 years,2024-03-15,yt-28626438,53.05,42x31x46 cm
136,Over,15,9.71,938,Sport myself pass paper meeting hospital authority go animal production big west make thing.,"Colon, Moore and Gonzales",3 years,2024-02-01,sT-21564745,261.78,5x10x6 cm
137,The,15,37.76,851,Agreement development television same focus early similar year now democratic then.,Rodriguez Ltd,5 years,2023-11-04,SP-45540727,302.25,43x6x4 cm
138,Player,10,7.57,950,Administration compare something race agree improve employee instead too.,"Henderson, Myers and Alvarez",2 years,2019-12-19,Cm-83889840,138.35,45x4x47 cm
139,Adult,20,1.8,13,Your until assume use smile song.,Perez-Clark,4 years,2019-07-01,nB-53528916,9.93,12x7x50 cm
140,Meeting,5,1.7,100,State trial rate type live receive force work minute.,"Mclean, Lynn and Garcia",5 years,2020-11-04,JD-53631859,290.0,1x40x28 cm
141,Deep,13,28.94,222,Health pay trade growth establish available indeed too end receive figure.,"Roberson, Mcmahon and Smith",3 years,2023-08-09,sR-45734014,295.58,32x22x41 cm
142,One,3,0.08,585,Paper even contain issue tax collection level.,Lloyd-Miller,3 years,2019-12-25,Jn-40794263,256.29,29x35x45 cm
143,Hour,11,42.09,914,Everybody tough above between care think term instead now act society prepare run.,Chavez LLC,2 years,2023-11-15,Ro-34459532,49.42,50x47x1 cm
144,Meeting,9,36.81,344,Away our outside clear west church apply cell want itself whom.,"Jones, Jordan and Graham",2 years,2022-06-07,eJ-31174122,222.25,46x44x27 cm
145,Until,19,19.74,60,Set practice significant outside quite suddenly open brother wide.,Jones-Caldwell,4 years,2020-03-17,MB-98253426,357.21,25x29x45 cm
146,Free,14,12.43,160,For event deal administration seek article start east important despite.,Davis-Snow,4 years,2020-12-26,Zm-63886256,541.38,49x34x31 cm
147,Owner,9,57.41,702,Room large successful follow week fish.,"Lewis, Roberts and Adams",2 years,2020-01-17,jY-40895412,37.9,39x23x20 cm
148,Sure,5,14.13,298,Special father nor agreement treatment hot but.,Holmes-Yang,1 years,2022-03-06,sZ-96826554,256.66,11x17x25 cm
149,True,18,2.99,453,Democratic quickly ten moment professor risk.,Powell Group,3 years,2023-08-22,KN-31802946,36.64,38x39x22 cm
150,Attention,4,18.71,423,Since father kitchen style character city cause candidate they sure.,"Mendez, Mccullough and Thomas",3 years,2019-09-20,DU-86644518,118.15,4x10x17 cm
151,Add,6,16.85,747,Several street culture student road subject determine respond.,"Rogers, Adams and Young",3 years,2022-09-30,je-50320293,129.09,29x26x24 cm
152,Plan,15,30.12,827,Other hope table benefit box artist exactly want hear worker general.,"Smith, Wong and Scott",4 years,2022-01-06,pQ-88434971,524.71,29x3x17 cm
153,Appear,6,47.12,260,Forget debate table finish car develop fly peace also lot.,Reid and Sons,2 years,2022-05-31,Se-30793509,323.63,16x47x8 cm
154,Charge,4,17.53,914,Art nation recognize benefit eight talk police.,Jones-Tran,1 years,2022-03-17,vS-38259076,914.76,5x25x49 cm
155,Suggest,13,20.2,169,Carry state rest line board itself air film front little.,"Elliott, Higgins and Cook",4 years,2022-07-04,QB-46014733,310.62,47x30x20 cm
156,Cost,1,30.85,71,Food beautiful sure design could team question herself.,"Davis, Bailey and Scott",3 years,2023-08-07,oG-80483218,32.51,30x26x23 cm
157,Magazine,5,40.89,967,Same deep ask whose happy law head big environment.,Brock-Lucas,4 years,2020-10-28,IE-95923277,81.05,43x11x1 cm
158,Pretty,8,42.37,32,Little character film weight scene go.,Mcmillan Inc,5 years,2022-04-09,tK-92303666,74.83,23x36x12 cm
159,Arm,14,6.56,473,Sit floor suffer me professor once create knowledge save early pull call.,Hall PLC,2 years,2023-04-27,CP-93169229,125.47,20x7x38 cm
160,Watch,5,21.48,454,Big since indicate recently table center.,Scott-Wilson,2 years,2022-10-02,Hi-32268229,385.37,47x2x9 cm
161,Total,20,10.47,644,Game also billion long society follow successful become.,"Johnson, Perez and Wilson",4 years,2021-04-10,Ma-41517473,628.32,33x17x47 cm
162,Chance,19,1.3,925,Opportunity line man wind view know professor pay.,Johnson-Williams,1 years,2023-05-19,Cm-46018065,347.24,16x21x18 cm
163,Scene,19,3.62,107,Option sound most ok medical we south almost foot statement kitchen.,Chandler-Knight,5 years,2022-04-02,VU-99783291,134.25,16x3x36 cm
164,Kid,10,6.1,183,Treat yard nature save important father soon.,Robertson-Gardner,3 years,2022-10-28,sS-68633817,232.27,7x39x14 cm
165,Whose,20,14.37,160,Give fight industry continue performance can recent free traditional law last.,"Blanchard, Gonzalez and Reed",1 years,2022-11-18,lS-49281712,352.57,32x32x6 cm
166,Either,7,40.97,430,Friend college can ahead produce her where husband stock pass strong section start.,Skinner-Baldwin,2 years,2024-01-10,bD-63196109,451.59,3x40x28 cm
167,Little,4,2.56,946,Official suddenly subject end foot become in hot later movie land east they.,Vega and Sons,4 years,2021-04-27,yZ-84263893,644.7,48x10x40 cm
